{
  "$schema": "https://json-schema.org/draft/2020-12/schema",
  "$id": "https://kaogong.local/schema/article.schema.json",
  "title": "ClippedArticle",
  "description": "剪藏原文（对应原项目 data/原文/{date}/*.json）。权威契约：Python 侧据此校验产出。",
  "type": "object",
  "additionalProperties": false,
  "required": [
    "id", "date", "title", "source", "url",
    "pubDate", "fetchedAt", "status", "paragraphs", "keySentences"
  ],
  "properties": {
    "id": { "type": "string", "minLength": 1 },
    "date": { "type": "string", "format": "date", "description": "YYYY-MM-DD" },
    "title": { "type": "string", "minLength": 1 },
    "source": { "type": "string", "minLength": 1 },
    "url": { "type": "string", "format": "public-http-url" },
    "pubDate": {
      "oneOf": [
        { "const": "" },
        { "type": "string", "minLength": 1, "format": "date" }
      ],
      "description": "原文发布日期，可为空字符串"
    },
    "fetchedAt": { "type": "string", "format": "strict-date-time" },
    "status": { "enum": ["ok", "error"] },
    "paragraphs": {
      "type": "array",
      "items": { "type": "string", "minLength": 1 }
    },
    "keySentences": {
      "type": "array",
      "items": { "type": "string", "minLength": 1 },
      "description": "金句摘录"
    },
    "aiStatus": {
      "enum": ["pending", "ok", "error"],
      "description": "AI 处理状态；历史内容可暂时缺少该字段"
    },
    "aiSummary": {
      "type": "string",
      "minLength": 60,
      "maxLength": 150,
      "description": "首页 AI 概括，目标 80-120 个中文字符，发布允许 60-150"
    },
    "aiAnnotations": {
      "type": "array",
      "maxItems": 30,
      "items": { "$ref": "#/$defs/aiAnnotation" }
    },
    "aiRelations": {
      "type": "array",
      "maxItems": 20,
      "items": { "$ref": "#/$defs/aiRelation" },
      "description": "关系标注（中心句→支撑点，即「箭头」）：AI 生成初稿，人工可修正；引用 aiAnnotations[].id；支撑点允许跨段（真实总分结构常跨段）"
    },
    "aiCards": {
      "type": "array",
      "maxItems": 8,
      "items": { "$ref": "#/$defs/aiCard" },
      "description": "AI 提炼的考点卡片（待人工确认后发布；字段与 card.schema.json 的 card def 一致，由一致性测试保证）"
    },
    "policyLine": {
      "type": "string",
      "pattern": "^[a-z0-9-]+$",
      "description": "文章归属的活跃主线 slug（policy-lines.json 的 id）；无归属文章省略"
    },
    "evergreen": {
      "type": "boolean",
      "description": "是否可长期作为「补剧」素材（历史文章重提）；默认 false"
    },
    "aiModel": { "type": "string", "minLength": 1 },
    "aiPromptVersion": { "type": "string", "minLength": 1 },
    "aiGeneratedAt": { "type": "string", "format": "strict-date-time" },
    "sourceTextHash": {
      "type": "string",
      "pattern": "^[a-f0-9]{64}$",
      "description": "按 paragraphs 规范化后计算的 SHA-256 十六进制值"
    },
    "aiError": {
      "type": "string",
      "minLength": 1,
      "maxLength": 500
    },
    "aiFocus": {
      "type": "object",
      "additionalProperties": false,
      "required": ["from", "to"],
      "properties": {
        "from": { "type": "integer", "minimum": 0, "description": "起始段索引（闭区间，0 起）" },
        "to": { "type": "integer", "minimum": 0, "description": "结束段索引（闭区间）" }
      },
      "description": "AI 段落聚焦（v2.1 §7.3）：整篇并非全部值得精读、仅连续若干段有政策阐释/考点价值时的段落范围；跨字段校验 0 ≤ from ≤ to < 段数在 validate_article_ai"
    },
    "aiQuality": {
      "type": "object",
      "additionalProperties": false,
      "required": ["locationErrors"],
      "properties": {
        "locationErrors": { "type": "integer", "minimum": 0 }
      }
    }
  },
  "allOf": [
    {
      "if": { "required": ["aiStatus"], "properties": { "aiStatus": { "const": "ok" } } },
      "then": {
        "required": [
          "aiSummary", "aiAnnotations", "aiModel", "aiPromptVersion",
          "aiGeneratedAt", "sourceTextHash", "aiQuality"
        ],
        "not": { "required": ["aiError"] }
      }
    },
    {
      "if": { "required": ["aiStatus"], "properties": { "aiStatus": { "const": "error" } } },
      "then": {
        "required": [
          "aiAnnotations", "aiModel", "aiPromptVersion", "aiGeneratedAt",
          "sourceTextHash", "aiError"
        ],
        "properties": {
          "aiAnnotations": { "maxItems": 0 }
        },
        "not": { "anyOf": [{ "required": ["aiSummary"] }, { "required": ["aiQuality"] }] }
      }
    },
    {
      "if": { "required": ["aiStatus"], "properties": { "aiStatus": { "const": "pending" } } },
      "then": {
        "not": {
          "anyOf": [
            { "required": ["aiSummary"] },
            { "required": ["aiError"] },
            { "required": ["aiAnnotations"] },
            { "required": ["aiModel"] },
            { "required": ["aiPromptVersion"] },
            { "required": ["aiGeneratedAt"] },
            { "required": ["sourceTextHash"] },
            { "required": ["aiQuality"] }
          ]
        }
      }
    }
  ],
  "$defs": {
    "aiAnnotation": {
      "type": "object",
      "additionalProperties": false,
      "required": ["id", "paragraphIndex", "start", "end", "text", "type"],
      "properties": {
        "id": { "type": "string", "minLength": 1 },
        "paragraphIndex": { "type": "integer", "minimum": 0 },
        "start": { "type": "integer", "minimum": 0 },
        "end": { "type": "integer", "minimum": 1 },
        "text": { "type": "string", "minLength": 1, "maxLength": 500 },
        "type": { "enum": ["viewpoint", "exam_point", "term", "figure"] },
        "explanation": {
          "type": "string",
          "minLength": 30,
          "maxLength": 80,
          "description": "仅政策术语使用；生成失败时省略，不得伪造"
        }
      },
      "allOf": [
        {
          "if": { "properties": { "type": { "const": "term" } }, "required": ["type"] },
          "then": {},
          "else": { "not": { "required": ["explanation"] } }
        }
      ]
    },
    "aiRelation": {
      "type": "object",
      "additionalProperties": false,
      "required": ["id", "paragraphIndex", "anchor", "points", "kind", "aiGenerated"],
      "properties": {
        "id": { "type": "string", "minLength": 1 },
        "paragraphIndex": { "type": "integer", "minimum": 0 },
        "anchor": {
          "type": "string",
          "minLength": 1,
          "description": "中心句：引用同文件 aiAnnotations[].id"
        },
        "points": {
          "type": "array",
          "minItems": 1,
          "maxItems": 5,
          "items": { "$ref": "#/$defs/aiRelationPoint" }
        },
        "kind": { "enum": ["support", "explain", "example", "contrast"], "description": "关系簇类型" },
        "aiGenerated": { "type": "boolean", "description": "是否 AI 生成初稿" },
        "editedAt": {
          "type": "string",
          "format": "strict-date-time",
          "description": "人工修正时间；存在且晚于文章 aiGeneratedAt 时管道重跑不得覆盖（locked）"
        },
        "editedBy": { "type": "string", "minLength": 1, "description": "人工修正者标识" }
      }
    },
    "aiRelationPoint": {
      "type": "object",
      "additionalProperties": false,
      "required": ["annotationId", "kind"],
      "properties": {
        "annotationId": {
          "type": "string",
          "minLength": 1,
          "description": "支撑点：引用同文件 aiAnnotations[].id"
        },
        "kind": { "enum": ["support", "explain", "example", "contrast"] }
      }
    },
    "aiCard": {
      "type": "object",
      "additionalProperties": false,
      "required": ["id", "question", "answer", "tags"],
      "properties": {
        "id": { "type": "string", "minLength": 1, "description": "全局唯一卡片 id（card-{articleId}-{n}）" },
        "question": { "type": "string", "minLength": 10, "maxLength": 40, "description": "正面问题（主动回忆）" },
        "answer": { "type": "string", "minLength": 6, "maxLength": 200, "description": "反面答案" },
        "explain": { "type": "string", "minLength": 10, "maxLength": 400, "description": "思路/逐项解析（可选），答完题展示" },
        "tags": {
          "type": "array",
          "minItems": 1,
          "maxItems": 5,
          "items": { "type": "string", "minLength": 1 },
          "description": "标签，如 定位/目标/数字"
        },
        "policyLine": {
          "type": "string",
          "pattern": "^[a-z0-9-]+$",
          "description": "卡片归属的主线 slug；由程序回填"
        },
        "examPointId": { "type": "string", "minLength": 1, "description": "所属考点（结构化考点库阶段 2；可先空）" },
        "anchor": {
          "type": "object",
          "additionalProperties": false,
          "required": ["articleId", "paragraphIndex"],
          "properties": {
            "articleId": { "type": "string", "minLength": 1, "description": "出处文章 id（程序回填）" },
            "paragraphIndex": { "type": "integer", "minimum": 0, "description": "出处段落下标" },
            "sentence": { "type": "string", "minLength": 1, "description": "出处原文连续子串，程序逐字定位" }
          },
          "description": "卡片↔精读锚定"
        }
      }
    }
  }
}
