{
  "id": "3684722d34",
  "date": "2026-09-04",
  "title": "成都这所中学5名学子成为清华或北大“双学籍”飞行学员",
  "source": "sichuan.scol.com.cn",
  "url": "https://sichuan.scol.com.cn/ggxw/202609/83316780.html",
  "pubDate": "",
  "fetchedAt": "2026-09-04T23:44:51+00:00",
  "status": "ok",
  "paragraphs": [
    "9月4日，记者从四川大学附属中学获悉，该校收到了空军招飞局成都选拔中心发来的贺信，祝贺该校高2023级航空实验班5名学子被录取为清华或北大“双学籍”飞行学员。其中，2人被录取为空军与清华大学联合培养“双学籍”飞行学员，3人被录取为空军与北京大学联合培养“双学籍”飞行学员。",
    "从2011年开始，空军先后与清华大学、北京大学、北京航空航天大学合作，采取“3+1”模式联合培养飞行学员。根据计划，空军每年从新招收的理科类高中生飞行学员中遴选确定预选对象，组织到空军航空大学进行军政训练和体验飞行，综合择优录取高考成绩优异、体验飞行合格的学员，入地方高校学习。",
    "联合培养飞行学员注册空军航空大学和地方高校“双学籍”，在地方高校学习期间，享受军队院校飞行学员相关待遇。毕业考核合格的，颁发空军航空大学和地方高校同时具印的大学本科毕业证书，并按规定分别授予相应学士学位。",
    "截至目前，四川大学附属中学共培养了160余名空军飞行学员，其中近20人成为清华或北大“双学籍”飞行学员。"
  ],
  "keySentences": [],
  "aiModel": "deepseek-chat",
  "aiPromptVersion": "article-analysis-v1",
  "aiGeneratedAt": "2026-09-04T23:44:53+00:00",
  "sourceTextHash": "1203befe86a7374d4a6f1d7bd7ec908960cbebfdf7abb455b5fdd9039b8b1a62",
  "aiStatus": "ok",
  "aiSummary": "四川大学附属中学5名航空实验班学子被录取为清华或北大“双学籍”飞行学员，其中2人清华、3人北大。该校累计培养160余名空军飞行学员，近20人获此殊荣。",
  "aiAnnotations": [
    {
      "id": "ai-0-56-78-viewpoint",
      "paragraphIndex": 0,
      "start": 56,
      "end": 78,
      "text": "5名学子被录取为清华或北大“双学籍”飞行学员",
      "type": "viewpoint"
    },
    {
      "id": "ai-1-9-52-exam_point",
      "paragraphIndex": 1,
      "start": 9,
      "end": 52,
      "text": "空军先后与清华大学、北京大学、北京航空航天大学合作，采取“3+1”模式联合培养飞行学员",
      "type": "exam_point"
    },
    {
      "id": "ai-1-108-130-exam_point",
      "paragraphIndex": 1,
      "start": 108,
      "end": 130,
      "text": "综合择优录取高考成绩优异、体验飞行合格的学员",
      "type": "exam_point"
    },
    {
      "id": "ai-2-0-26-term",
      "paragraphIndex": 2,
      "start": 0,
      "end": 26,
      "text": "联合培养飞行学员注册空军航空大学和地方高校“双学籍”",
      "type": "term",
      "explanation": "指飞行学员同时具有军队院校和地方高校双重学籍，享受双方资源与待遇。"
    },
    {
      "id": "ai-3-5-28-viewpoint",
      "paragraphIndex": 3,
      "start": 5,
      "end": 28,
      "text": "四川大学附属中学共培养了160余名空军飞行学员",
      "type": "viewpoint"
    }
  ],
  "aiQuality": {
    "locationErrors": 0
  }
}