{
  "id": "de1efca3d6",
  "date": "2026-09-06",
  "title": "一座白塔，一条岸线，串起文商旅新体验丨市州观察",
  "source": "sichuan.scol.com.cn",
  "url": "https://sichuan.scol.com.cn/ggxw/202609/83317364.html",
  "pubDate": "",
  "fetchedAt": "2026-09-06T23:30:24+00:00",
  "status": "ok",
  "paragraphs": [
    "8月31日，广安市广安区白塔公园沿江步道上，市民姜超举起手机，将古塔和蓝天框入镜头。此前，由于江风雨水侵蚀，塔身砖石风化剥落，广安白塔一度关闭。&ldquo;现在可以说脱胎换骨了，周围环境也比以前整洁清爽。&rdquo;姜超感慨。",
    "广安白塔及其周边的变化，是广安区推动文物保护修缮、探索文商旅融合发展的成果之一，也是广安探索生态与文旅协同发展的缩影。",
    "以白塔为锚点，以渠江滨江岸线为基线，广安区正着力构建&ldquo;点&mdash;线&mdash;面&rdquo;联动发展格局，串联起渠江两岸文化资源，推动历史文物从&ldquo;保护好&rdquo;&ldquo;美起来&rdquo;迈向&ldquo;用起来&rdquo;&ldquo;活起来&rdquo;。",
    "近日，在广安区浓洄街道广安文庙建设现场，施工人员加紧推进外围环境风貌提升。墙外是如火如荼的改造建设，墙内的古建筑群则静谧安然。一墙之隔，新旧共生。",
    "广安文庙始建于宋代，是第七批省级文物保护单位。为守护好这份历史遗产，广安区秉承最小干预原则，以&ldquo;微更新、微改造&rdquo;理念推进古建筑修缮。",
    "广安区文管所相关负责人袁博介绍，活化以文庙为代表的儒家文化遗产，当地于2022年10月邀请四川博物院、&zwnj;西南民族大学的文化专家指导文庙展陈设计，确定&ldquo;文脉流光&rdquo;展览主题及空间整体设计方案。2024年，四川省文物局批复同意大成殿设计变更方案，2025年当地完成文庙陈列布展，&ldquo;团队严格对照地方志记载的形制尺寸，按原样式补配大成殿檐下斗拱，并沿用旧址的柱础、墙体和物料，最大限度保留古建筑历史质感。&rdquo;",
    "以&ldquo;微更新&rdquo;撬动片区整体提升，环境风貌提升同样是重中之重。袁博说，广安文庙片区环境整治工程预计明年2月完工，未来将引入研学、文创、数字展陈等业态，让广安文庙焕发活力。",
    "同样以&ldquo;修旧如旧&rdquo;为原则，以环境治理为重点，广安白塔的保护性维护工程也历时数年。2018年，广安区投入600余万元文物保护专项经费，系统实施抢险加固工程，同时拆除多余构筑物和花草灌木，采用极简造景手法打开景观视廊。如今，广安白塔公园已成为集文化展示、休闲健身、生态观光于一体的人文公园。",
    "8月30日，在广安建川博物馆聚落，12岁的周俊祺跟着父亲走进展馆，通过老照片了解历史，&ldquo;看起来很直观，比课堂上生动多了。&rdquo;",
    "让&ldquo;沉睡&rdquo;文物融入现代生活，是广安区活化利用文化遗产的核心逻辑。文物活化既是城市更新的重要部分，也是文脉传承的关键抓手。随着白塔公园逐步引入多元业态，广安区将建设重心向渠江两岸延伸，沿江岸布局一批改造提升项目，推进生态、文态、形态、业态&ldquo;四态&rdquo;融合。",
    "以广安不夜城为例，当地引入专业运营团队，完善配套服务保障，将其打造为宋韵主题街区，形成&ldquo;白天逛白塔公园，夜晚游不夜城&rdquo;的全时段文旅消费闭环。",
    "广安建川博物馆聚落则保留川东民居建筑风貌，沿着传统青石板路，人们可近距离了解红色文化和民俗记忆。&ldquo;我们挖掘活化老街商贸民俗、本土名人故事等文化印记，打造3D文化长廊、民俗戏台、老业态复原场景，走出一条文化保护优先、业态适度活化的发展路径。&rdquo;广安建川博物馆聚落相关负责人刘伯清说。",
    "如今，过境观光客流正转化为沉浸式体验客流，&ldquo;红色IP+百年古街+博物馆矩阵&rdquo;形成的文旅资源，成为广安区重点打造的文商旅一体化核心载体。刘伯清说：&ldquo;我们将招引本地商户住户入驻，启动恢复协兴老街赶集百年传统相关工作，重点承接文化传承类、馆街IP融合类业态，同时配套完善夜间经济业态，打造白天观光研学、夜间休闲消费的全天候特色街区。&rdquo;"
  ],
  "keySentences": [],
  "aiModel": "deepseek-chat",
  "aiPromptVersion": "article-analysis-v1",
  "aiGeneratedAt": "2026-09-06T23:30:26+00:00",
  "sourceTextHash": "1f9c0783c38a5533289763c6f19273afee6ecb507b8a2e922df83aca22d6860e",
  "aiStatus": "ok",
  "aiSummary": "广安区以白塔和渠江岸线为依托，通过微更新、修旧如旧等原则修缮文物，串联文庙、博物馆等资源，引入多元业态，推动文商旅融合，实现历史文物活化利用与生态文旅协同发展。",
  "aiAnnotations": [
    {
      "id": "ai-0-45-71-viewpoint",
      "paragraphIndex": 0,
      "start": 45,
      "end": 71,
      "text": "由于江风雨水侵蚀，塔身砖石风化剥落，广安白塔一度关闭",
      "type": "viewpoint"
    },
    {
      "id": "ai-0-0-5-exam_point",
      "paragraphIndex": 0,
      "start": 0,
      "end": 5,
      "text": "8月31日",
      "type": "exam_point"
    },
    {
      "id": "ai-4-0-22-exam_point",
      "paragraphIndex": 4,
      "start": 0,
      "end": 22,
      "text": "广安文庙始建于宋代，是第七批省级文物保护单位",
      "type": "exam_point"
    },
    {
      "id": "ai-5-35-43-exam_point",
      "paragraphIndex": 5,
      "start": 35,
      "end": 43,
      "text": "2022年10月",
      "type": "exam_point"
    },
    {
      "id": "ai-5-111-136-exam_point",
      "paragraphIndex": 5,
      "start": 111,
      "end": 136,
      "text": "2024年，四川省文物局批复同意大成殿设计变更方案",
      "type": "exam_point"
    },
    {
      "id": "ai-7-52-77-exam_point",
      "paragraphIndex": 7,
      "start": 52,
      "end": 77,
      "text": "2018年，广安区投入600余万元文物保护专项经费",
      "type": "exam_point"
    },
    {
      "id": "ai-10-50-64-exam_point",
      "paragraphIndex": 10,
      "start": 50,
      "end": 64,
      "text": "白天逛白塔公园，夜晚游不夜城",
      "type": "exam_point"
    },
    {
      "id": "ai-12-28-43-exam_point",
      "paragraphIndex": 12,
      "start": 28,
      "end": 43,
      "text": "红色IP+百年古街+博物馆矩阵",
      "type": "exam_point"
    },
    {
      "id": "ai-4-39-45-term",
      "paragraphIndex": 4,
      "start": 39,
      "end": 45,
      "text": "最小干预原则",
      "type": "term"
    },
    {
      "id": "ai-7-10-14-term",
      "paragraphIndex": 7,
      "start": 10,
      "end": 14,
      "text": "修旧如旧",
      "type": "term"
    },
    {
      "id": "ai-9-137-139-term",
      "paragraphIndex": 9,
      "start": 137,
      "end": 139,
      "text": "四态",
      "type": "term"
    }
  ],
  "aiQuality": {
    "locationErrors": 4
  }
}