{
  "id": "6d97553e19",
  "date": "2026-09-05",
  "title": "遥望雪山之后，蓝天治理迎来新阶段",
  "source": "sichuan.scol.com.cn",
  "url": "https://sichuan.scol.com.cn/ggxw/202609/83317144.html",
  "pubDate": "",
  "fetchedAt": "2026-09-05T23:35:16+00:00",
  "status": "ok",
  "paragraphs": [
    "9月5日，2026年国际清洁空气蓝天日主题活动在成都举行。活动以大气治理成都实践为窗口，促进城市间经验交流和多元主体协同，为建设美丽中国、推动亚洲城市实现清洁空气与低碳发展共赢凝聚智慧。",
    "来自生态环境部、科研院所、国际机构及企业的多位专家，围绕“十五五”时期城市大气治理与低碳发展展开深入研讨，总结过往治理成效，共同商讨下一阶段攻坚路径。这场在雪山下的公园城市举办的对话，为空气质量持续改善注入新动力。",
    "从“明显改善”向“全面改善”过渡，蓝天治理进入下半场",
    "活动现场，一组数据被多次提及。2025年，全国PM2.5平均浓度降至28微克每立方米，优良天数比例、重污染天数比例等指标均为有监测记录以来的最好水平。",
    "四川的答卷同样亮眼。PM2.5浓度去年首次降到30微克每立方米以下，首次进入“2字头”时代，创有监测记录以来最好成绩。",
    "而作为活动举办地的成都，在“十四五”期间，PM2.5浓度下降15.6%，2024年、2025年连续两年达标。成都市环境保护科学研究院副院长赵彬给出了更具画面感的描述：近年来，每年在城区遥望雪山的天数达到60至70次，“窗含西岭千秋雪”的诗意已经成为市民的生活日常。",
    "成绩背后是治理难度的几何级增长。“进入‘十五五’时期，大气污染治理的标准更高、分区更准，而治理空间越来越收窄。”生态环境部宣传教育中心党委委员、副主任林玉在发言中形容，过去的治理是按“1微克1微克地扣”，未来则要面临“0.1微克0.1微克地减”，当前空气质量改善正处于从“明显改善”向“全面改善”过渡的关键期，标准要求更高、分区施策更准、路径措施更科学。",
    "这种精细化治理的背后，意味着依靠工程减排和行政推动的上半场模式已然成为过去式，治理的下半场必须向生产生活方式绿色转型要空间。",
    "新的考题，已经摆在面前。今年，国家修订实施了新的环境空气质量标准，进一步收紧了PM2.5等污染物限值，将PM2.5年均浓度达标线调整为25微克/立方米。",
    "中国环境科学研究院研究员柴发合算了一笔账：如果按照25微克每立方米的目标，以2025年监测值计算，全国只有140个城市达标，达标率下降48%；即便是按过渡标准，也仅有约205个城市达标。“成都本来已经连续两年达标，但按照新标准，又站在了新的起点上。”他说。",
    "在亚洲清洁空气中心中国区总监万薇看来，老标准下城市达标比例约为七成，新标准下可能变成“三七开”，与此同时，中国作为世界制造基地，能源结构、工业结构、交通运输方式仍偏重，减污降碳协同推进都面临着从“达标”向“提质”的发展压力。",
    "“十五五”期间的大气污染治理，将是一场围绕“微克”展开的更具挑战性的持久战。",
    "“大气治理的下半场，也是人心共识的治理。”林玉表示，进入下半场，更多的增量空间要靠全社会环保意识的提升，靠整个社会生产生活方式的绿色转型来实现。",
    "这样的转型正在全国展开。全国风光水电装机容量连续多年稳居世界第一，燃煤锅炉数量从2013年的近50万台降至目前不到2万台；2013年以来累计淘汰高排放老旧车辆近6000万辆，新能源汽车产销量连续11年位居全球第一，2025年电动重卡销量达23.1万辆，同比增长182%。",
    "减污降碳协同，不仅需要结构调整，更需要制度层面的融合。中国环境科学研究院研究员高庆先认为，“十五五”期间要推动减污和降碳，碳市场扩容要与排污权交易、环境税等密切融合，同时要加强协同效应的量化研究，让减排的经济效益可计算、可评估。",
    "在城市层面，成都的探索提供了可复制的样本。这座被群山环绕、常年风速仅1至2米每秒的超大城市，从公共领域车辆电动化这个“小切口”入手，实现新能源车贡献里程超60%，主干道边二氧化氮浓度较2020年下降20%至45%；天府新区天府智能制造产业园项目则打造全国首个全生命周期绿色低碳项目，新能源机具替代率在多个工种达100%。",
    "企业端的实践同样关键。成都环境投资集团有限公司环境科学分公司经理白鹏坦言，当前减污和降碳的考核口径还不一致，一些污染控制措施反而增加了能耗，好技术落地也面临成本难题。他建议以园区为单元算总账，把污水、固废、空气治理、碳排放整合包装成成套服务，让环保项目从“不算账”变成“可算账”。",
    "当前，中国的实践，也正在通过亚洲清洁空气中心等平台分享给亚洲更多城市。“空气污染是我们共同面临的挑战，每座城市都有自己的特色，没有万能方案，但行之有效的经验可以相互学习，因地制宜。”亚洲清洁空气中心执行总裁比亚内·彼得森说。"
  ],
  "keySentences": [],
  "aiModel": "deepseek-chat",
  "aiPromptVersion": "article-analysis-v1",
  "aiGeneratedAt": "2026-09-05T23:35:17+00:00",
  "sourceTextHash": "2d6d6e01c7d6e05c56e2884a0985acb1056bc4016c91a7c6a9500eb2603bc743",
  "aiStatus": "ok",
  "aiSummary": "2026年国际清洁空气蓝天日主题活动在成都举行，聚焦“十五五”大气治理。全国PM2.5浓度创纪录，但新标准提高达标难度，治理进入从“明显改善”向“全面改善”过渡的下半场，需依靠绿色转型和多元协同。",
  "aiAnnotations": [
    {
      "id": "ai-0-44-60-viewpoint",
      "paragraphIndex": 0,
      "start": 44,
      "end": 60,
      "text": "促进城市间经验交流和多元主体协同",
      "type": "viewpoint"
    },
    {
      "id": "ai-2-0-26-viewpoint",
      "paragraphIndex": 2,
      "start": 0,
      "end": 26,
      "text": "从“明显改善”向“全面改善”过渡，蓝天治理进入下半场",
      "type": "viewpoint"
    },
    {
      "id": "ai-6-84-122-viewpoint",
      "paragraphIndex": 6,
      "start": 84,
      "end": 122,
      "text": "过去的治理是按“1微克1微克地扣”，未来则要面临“0.1微克0.1微克地减”",
      "type": "viewpoint"
    },
    {
      "id": "ai-12-1-19-viewpoint",
      "paragraphIndex": 12,
      "start": 1,
      "end": 19,
      "text": "大气治理的下半场，也是人心共识的治理",
      "type": "viewpoint"
    },
    {
      "id": "ai-17-36-89-viewpoint",
      "paragraphIndex": 17,
      "start": 36,
      "end": 89,
      "text": "空气污染是我们共同面临的挑战，每座城市都有自己的特色，没有万能方案，但行之有效的经验可以相互学习，因地制宜",
      "type": "viewpoint"
    },
    {
      "id": "ai-3-15-42-exam_point",
      "paragraphIndex": 3,
      "start": 15,
      "end": 42,
      "text": "2025年，全国PM2.5平均浓度降至28微克每立方米",
      "type": "exam_point"
    },
    {
      "id": "ai-4-10-33-exam_point",
      "paragraphIndex": 4,
      "start": 10,
      "end": 33,
      "text": "PM2.5浓度去年首次降到30微克每立方米以下",
      "type": "exam_point"
    },
    {
      "id": "ai-5-21-35-exam_point",
      "paragraphIndex": 5,
      "start": 21,
      "end": 35,
      "text": "PM2.5浓度下降15.6%",
      "type": "exam_point"
    },
    {
      "id": "ai-8-51-75-exam_point",
      "paragraphIndex": 8,
      "start": 51,
      "end": 75,
      "text": "将PM2.5年均浓度达标线调整为25微克/立方米",
      "type": "exam_point"
    },
    {
      "id": "ai-9-49-70-exam_point",
      "paragraphIndex": 9,
      "start": 49,
      "end": 70,
      "text": "全国只有140个城市达标，达标率下降48%",
      "type": "exam_point"
    },
    {
      "id": "ai-13-87-106-exam_point",
      "paragraphIndex": 13,
      "start": 87,
      "end": 106,
      "text": "新能源汽车产销量连续11年位居全球第一",
      "type": "exam_point"
    },
    {
      "id": "ai-15-68-80-exam_point",
      "paragraphIndex": 15,
      "start": 68,
      "end": 80,
      "text": "新能源车贡献里程超60%",
      "type": "exam_point"
    },
    {
      "id": "ai-8-24-32-term",
      "paragraphIndex": 8,
      "start": 24,
      "end": 32,
      "text": "环境空气质量标准",
      "type": "term",
      "explanation": "规定空气中污染物浓度限值的法规文件，用于评估和管理空气质量，保障公众健康。"
    },
    {
      "id": "ai-14-0-6-term",
      "paragraphIndex": 14,
      "start": 0,
      "end": 6,
      "text": "减污降碳协同",
      "type": "term",
      "explanation": "指同时减少污染物排放和碳排放的策略，通过结构调整和制度融合实现环境与气候效益。"
    },
    {
      "id": "ai-15-129-140-term",
      "paragraphIndex": 15,
      "start": 129,
      "end": 140,
      "text": "全生命周期绿色低碳项目",
      "type": "term",
      "explanation": "从设计、建设到运营全过程考虑环境影响和碳排放的项目，旨在实现资源高效和低碳排放。"
    }
  ],
  "aiQuality": {
    "locationErrors": 0
  }
}