{
  "id": "0d74056eb0",
  "date": "2026-09-06",
  "title": "亚太媒体高端论坛在深圳举办",
  "source": "news.dayoo.com",
  "url": "https://news.dayoo.com/guangdong/202609/06/139996_55000372.htm",
  "pubDate": "",
  "fetchedAt": "2026-09-06T23:29:31+00:00",
  "status": "ok",
  "paragraphs": [
    "新华社深圳9月5日电 亚太媒体高端论坛5日在广东深圳开幕。中共中央政治局委员、中宣部部长李书磊出席开幕式并发表主旨演讲。中共中央政治局委员、广东省委书记黄坤明出席并致辞。",
    "与会嘉宾认为，习近平主席提出构建亚太共同体的重大主张，为共建开放型亚太经济、推动亚太共同繁荣提供了重要指引。今年是亚太经合组织（APEC）“中国年”，中国将举办亚太经合组织第三十三次领导人非正式会议，相信在各方支持下，会议将取得丰硕成果，推动亚太合作迈上新台阶。",
    "与会嘉宾表示，亚太地区的发展合作，离不开亚太媒体的积极参与。要讲好亚太开放融通故事，全方位报道亚太各领域合作进展成效，营造亚太开放发展的良好舆论环境。要积极宣介APEC系列成果，阐释解读各方支持科技创新的政策举措，凝聚亚太创新发展的区域共识。要深入开展联合采访、技术创新、人才培养等务实合作，以媒体交流传承文明、传播文化、传递友好，促进亚太人民相知相亲。",
    "论坛以“共筑亚太共同体繁荣之路：媒体的共识与行动”为主题，由中宣部、新华社、广东省人民政府主办，深圳市人民政府承办。来自40多个国家和地区以及联合国机构、国际组织的400余位代表出席。论坛上中外16家媒体发起成立亚太媒体合作伙伴计划筹委会。"
  ],
  "keySentences": [],
  "aiModel": "deepseek-chat",
  "aiPromptVersion": "article-analysis-v1",
  "aiGeneratedAt": "2026-09-06T23:29:32+00:00",
  "sourceTextHash": "f627a7776da2b99e63e3b5d6b58a284d762571adc615e792cd66070844da848d",
  "aiStatus": "error",
  "aiAnnotations": [],
  "aiError": "ai_semantic:summary_length"
}