{
  "id": "5036c7a2a2",
  "date": "2026-09-11",
  "title": "30多位复旦校友企业家“组团”来川，干了什么？",
  "source": "sichuan.scol.com.cn",
  "url": "https://sichuan.scol.com.cn/ggxw/202609/83320793.html",
  "pubDate": "",
  "fetchedAt": "2026-09-11T23:55:15+00:00",
  "status": "ok",
  "paragraphs": [
    "9月10日，一场带着“校友”特殊情谊的专场对接活动在四川天府新区启幕。30余位复旦校友企业家代表齐聚成都，其中包括万华化学、艾美疫苗、一品红、德业股份、智明达、诺泰生物等多家上市企业。",
    "不同于走马观花式的参观考察，这一次，企业家们带着产业视角而来，实地摸底成都的产业土壤，寻找双向合作的可能性。",
    "本次活动由成都市委金融办、复旦大学国际金融学院、成都市民营经济发展促进中心、四川天府新区管委会联合主办。活动期间，企业代表先后走进天府新区规划展厅、天府基金特色小镇、重点企业及智算中心开展实地调研。",
    "此次调研之行，让不少企业家刷新了对成都、天府新区的固有认知。",
    "艾美疫苗董事局主席兼CEO周延感受深刻。到访前，他对成都的印象是“安逸闲适、烟火从容”，实地走访新区各类载体与重点企业后，他给出全新评价：“成都温润有温度，天府新区实干有硬度。”",
    "作为港交所上市企业，艾美疫苗是全球最大乙肝疫苗制造商、全球第二大狂犬病疫苗制造商，也是国内mRNA创新疫苗与癌症疫苗赛道的先行企业。在周延看来，天府新区最核心的竞争力在于优质完备的产业土壤，尤其是搭建起了生命健康产业的产业链闭环，从基础研究、创新研发、中试孵化到产业落地，链条十分完整，高度适配生物医药行业长周期、重配套、重生态的发展特性。",
    "聚焦多肽药物及小分子化药自主研发与定制研发生产的诺泰生物，通过走访沃飞长空等本地企业，真切感受到成都在培育新质生产力、推进产业创新升级方面的前沿态势。",
    "“四川上市公司百利天恒董事长朱义正是复旦校友，企业在成都发展得很好。”诺泰生物董事长童梓权认为，依托完善的产业基础，成都在中西部地区拥有强劲的辐射带动能力，他们将持续关注成都机遇，待时机成熟落地开展深度合作。",
    "不同领域的参会企业，也结合自身发展需求，给出差异化的评价。",
    "光储赛道头部企业德业股份，将目光锁定成都广阔的发展空间。德业股份云平台总经理常忠正表示，通过走访，他看到了国星宇航的科创成果、智算中心的算力布局、西门子灯塔工厂的智能制造示范，感受到成都齐全的工业门类和超前的产业布局。",
    "“东部找地捉襟见肘，西部有山有水，发展空间广阔。”他表示将持续对成都考察调研，积极寻找合作突破口。",
    "目前，成都市正重点发展壮大电子信息、装备制造2个万亿级产业和生物医药、轨道交通、航空航天、绿色低碳等10个以上千亿级产业。作为千年“交子故里”，成都金融科技发展势头迅猛，综合金融竞争力稳居全球前列。座谈会上，成都市委金融办介绍了产业与金融核心优势：不仅出台了《关于优化产业发展金融服务的实施意见》，健全完善产业金融支撑体系，还将制定企业上市全生命周期培育赋能政策，为实体企业、科创企业落地发展提供保障。",
    "“我们将用好全球校友网络资源，推动科创成果、人才资源、产业资本与成都市发展需求精准对接，实现校地双向赋能、互利共赢。”复旦大学国际金融学院相关负责人在现场表示。",
    "记者了解到，本次对接活动，是成都深耕校友经济、以校友资源赋能城市产业升级的一次行动。成都市委金融办相关负责人告诉记者，校友经济的核心价值，在于把高校校友的科创、人才、产业资源，与地方发展需求精准对接起来。这一工作并非单次活动的短期联动，而是常态化、长效化的产业赋能计划。",
    "当天活动现场，参会企业与机构围绕产业链协同、投融资对接、项目落地保障等话题开展交流，已达成多项初步合作意向。"
  ],
  "keySentences": [],
  "aiModel": "deepseek-chat",
  "aiPromptVersion": "article-analysis-v1",
  "aiGeneratedAt": "2026-09-11T23:55:16+00:00",
  "sourceTextHash": "8e2d7ae8ff736e70d9b95458bef845688ed4f2c779ef101a998ac4f735be9dbf",
  "aiStatus": "ok",
  "aiSummary": "30余位复旦校友企业家赴四川天府新区开展专场对接，实地调研产业载体与重点企业，刷新对成都的认知。活动由成都市委金融办等联合主办，聚焦产业链协同与投融资对接，达成多项初步合作意向，旨在以校友资源常态化赋能城市产业升级。",
  "aiAnnotations": [
    {
      "id": "ai-1-0-13-viewpoint",
      "paragraphIndex": 1,
      "start": 0,
      "end": 13,
      "text": "不同于走马观花式的参观考察",
      "type": "viewpoint"
    },
    {
      "id": "ai-4-70-88-viewpoint",
      "paragraphIndex": 4,
      "start": 70,
      "end": 88,
      "text": "成都温润有温度，天府新区实干有硬度。",
      "type": "viewpoint"
    },
    {
      "id": "ai-10-1-24-viewpoint",
      "paragraphIndex": 10,
      "start": 1,
      "end": 24,
      "text": "东部找地捉襟见肘，西部有山有水，发展空间广阔。",
      "type": "viewpoint"
    },
    {
      "id": "ai-12-44-57-viewpoint",
      "paragraphIndex": 12,
      "start": 44,
      "end": 57,
      "text": "实现校地双向赋能、互利共赢",
      "type": "viewpoint"
    },
    {
      "id": "ai-13-59-102-viewpoint",
      "paragraphIndex": 13,
      "start": 59,
      "end": 102,
      "text": "校友经济的核心价值，在于把高校校友的科创、人才、产业资源，与地方发展需求精准对接起来。",
      "type": "viewpoint"
    },
    {
      "id": "ai-0-26-32-term",
      "paragraphIndex": 0,
      "start": 26,
      "end": 32,
      "text": "四川天府新区",
      "type": "term",
      "explanation": "位于成都的国家级新区，是四川推动高质量发展、集聚高端产业和科创资源的重要平台。"
    },
    {
      "id": "ai-5-45-53-term",
      "paragraphIndex": 5,
      "start": 45,
      "end": 53,
      "text": "mRNA创新疫苗",
      "type": "term",
      "explanation": "利用信使核糖核酸指导细胞合成抗原蛋白，从而激发免疫反应的新型疫苗技术路线。"
    },
    {
      "id": "ai-6-53-58-term",
      "paragraphIndex": 6,
      "start": 53,
      "end": 58,
      "text": "新质生产力",
      "type": "term",
      "explanation": "以科技创新为主导、摆脱传统增长路径的先进生产力形态，具有高科技、高效能、高质量特征。"
    },
    {
      "id": "ai-11-66-70-term",
      "paragraphIndex": 11,
      "start": 66,
      "end": 70,
      "text": "交子故里",
      "type": "term",
      "explanation": "指成都，因北宋时期这里诞生了世界上最早的纸币交子，故有此称。"
    },
    {
      "id": "ai-0-35-52-exam_point",
      "paragraphIndex": 0,
      "start": 35,
      "end": 52,
      "text": "30余位复旦校友企业家代表齐聚成都",
      "type": "exam_point"
    },
    {
      "id": "ai-2-5-51-exam_point",
      "paragraphIndex": 2,
      "start": 5,
      "end": 51,
      "text": "成都市委金融办、复旦大学国际金融学院、成都市民营经济发展促进中心、四川天府新区管委会联合主办",
      "type": "exam_point"
    },
    {
      "id": "ai-5-15-40-exam_point",
      "paragraphIndex": 5,
      "start": 15,
      "end": 40,
      "text": "全球最大乙肝疫苗制造商、全球第二大狂犬病疫苗制造商",
      "type": "exam_point"
    },
    {
      "id": "ai-11-7-60-exam_point",
      "paragraphIndex": 11,
      "start": 7,
      "end": 60,
      "text": "重点发展壮大电子信息、装备制造2个万亿级产业和生物医药、轨道交通、航空航天、绿色低碳等10个以上千亿级产业",
      "type": "exam_point"
    },
    {
      "id": "ai-11-129-148-exam_point",
      "paragraphIndex": 11,
      "start": 129,
      "end": 148,
      "text": "《关于优化产业发展金融服务的实施意见》",
      "type": "exam_point"
    },
    {
      "id": "ai-13-120-134-exam_point",
      "paragraphIndex": 13,
      "start": 120,
      "end": 134,
      "text": "常态化、长效化的产业赋能计划",
      "type": "exam_point"
    },
    {
      "id": "ai-14-42-53-exam_point",
      "paragraphIndex": 14,
      "start": 42,
      "end": 53,
      "text": "已达成多项初步合作意向",
      "type": "exam_point"
    }
  ],
  "aiQuality": {
    "locationErrors": 1
  }
}