{
  "id": "72f52e8e51",
  "date": "2026-08-25",
  "title": "首届流行音乐创作大会（广东）启幕！不设门槛，首届流行音乐创作大赛来了",
  "source": "news.dayoo.com",
  "url": "https://news.dayoo.com/guangdong/202608/25/139996_54994965.htm",
  "pubDate": "",
  "fetchedAt": "2026-08-25T22:25:22+00:00",
  "status": "ok",
  "paragraphs": [
    "8月25日，首届流行音乐创作大会（广东）正式启幕，500余位全国音乐企业代表、行业专家、知名音乐厂牌代表、一线音乐人及制作人齐聚广州。大会依托广东流行音乐产业优势，发挥头部平台集聚效应，整合行业资源、优化创作生态，助力国内流行音乐高质量发展。",
    "在接受媒体采访时，歌手揽佬表示，此次参会他最希望深入了解广东音乐的发展。揽佬在惠州长大，对家乡的天气情有独钟，“天气好，什么都好。”另外，他也觉得广州人的表达方式和生活态度特别有趣，给他留下了深刻印象。",
    "据悉，本次大会设置权威发布、行业宣讲、联盟启动等核心环节，释放出广东厚植原创发展沃土、支持广大音乐人创作好歌曲的强烈信号，通过多元化活动为流行音乐产业创新发展注入全新活力。",
    "行业宣讲环节汇聚一众业内重磅嘉宾，嘉宾们围绕流行音乐产业现状、发展机遇与未来趋势展开分享，覆盖平台生态构建、新时代音乐创作表达、音综传播、游戏跨界、影视IP联动、线下演出价值、社交传播新触点等多个维度，为行业发展提供多元、专业的思考视角与实践思路。",
    "会上揭晓华语流行音乐原创榜，并举行流行音乐产业协作联盟成立仪式，搭建跨行业资源对接、协同发展的全新产业平台。",
    "在25日晚，坐落于广东奥林匹克体育中心南广场的广州音乐公园将正式亮相，曾比特、梁山山、黄智毅、林彩霞、赤野乐队五组音乐人将轮番登台，带来超两小时的沉浸式开幕演出。",
    "据悉，大赛坚持时代性、群众性、原创性、流行性四大原则，面向全国音乐工作者及爱好者开放，不设年龄、职业、资历门槛，旨在激发群众文艺创作活力，推动新时代主流声音通过流行音乐走进青年、触达大众。值得一提的是，大赛顺应音乐科技发展趋势，除传统原创赛道外，特别增设AI音乐赛道，鼓励参赛者运用人工智能技术进行流行音乐创作。",
    "即日起至10月25日，参赛者可登录酷狗音乐APP大赛页面提交作品，公众可在投稿期间收听、点赞，为喜爱的歌曲助力。投稿截止后，主办方将组织专业评审，结合点赞量、播放量、分享量等传播数据综合评定，最终产生46首获奖歌曲，其中原创作品30首、AI作品16首，获奖作品将获得推广扶持资源。",
    "涵盖八大维度 广州发布推动音乐产业高质量发展的若干措施",
    "另外在会上，广州市正式发布《广州市推动音乐产业高质量发展的若干措施》，从精品创作、产业集群、演出活动、空间建设、版权保护、金融服务、数字贸易及人才培养八大维度推出若干重点措施，推动广州音乐产业高质量发展，助力国际消费中心、国际演艺中心建设。",
    "一是实施精品创作扶持，常态化开展优秀文艺项目扶持评审，遴选优质原创音乐项目，给予专项资金扶持与多渠道宣传推广。",
    "二是打造音乐产业集群，整合汇聚国内国际优质流行音乐资源，推动产业要素集聚、业态迭代升级。",
    "三是鼓励音乐演出活动，积极搭建演艺展示平台，办好广州艺术季等品牌项目，发展票根经济。",
    "四是推动音乐空间建设，因地制宜打造特色音乐空间，以常态化音乐演艺活动带动经济增长。",
    "五是加强音乐版权保护，资助著作权登记费用，构建多方政府监管、行业自律、企业内控的协同维权机制。",
    "六是探索音乐金融服务，创新融资信用服务产品，加大对经营主体的融资支持。",
    "七是优化数字音乐贸易，推动数字音乐精品 IP 开发，树立广州数字内容品牌。",
    "八是加强音乐人才培养，通过推荐选拔、项目资助等系列措施，加快人才培育。",
    "近年来，广州数字文化娱乐产业蓬勃发展，涌现出酷狗音乐、网易集团等一批数字音乐龙头企业，网络音乐总产值约占全国四分之一。《广州市推动音乐产业高质量发展的若干措施》将奏响湾区流行音乐发展新乐章。",
    "文/广州日报新花城记者：张素芹、黄岸、莫斯其格、杨泽彬、何钻莹 实习生 谭斯文 、聂睿萱"
  ],
  "keySentences": [],
  "aiModel": "deepseek-chat",
  "aiPromptVersion": "article-analysis-v1",
  "aiGeneratedAt": "2026-08-25T22:25:24+00:00",
  "sourceTextHash": "a33d669904a2135d9aeec1ffd809f15b49111d14c353c50b01c9bde8d3ea79c4",
  "aiStatus": "ok",
  "aiSummary": "首届流行音乐创作大会（广东）在广州启幕，汇聚行业代表，发布原创榜并成立产业联盟。同时推出音乐产业高质量发展措施，启动不设门槛的创作大赛，增设AI赛道，推动流行音乐高质量发展。",
  "aiAnnotations": [
    {
      "id": "ai-0-67-121-viewpoint",
      "paragraphIndex": 0,
      "start": 67,
      "end": 121,
      "text": "大会依托广东流行音乐产业优势，发挥头部平台集聚效应，整合行业资源、优化创作生态，助力国内流行音乐高质量发展。",
      "type": "viewpoint"
    },
    {
      "id": "ai-2-29-60-viewpoint",
      "paragraphIndex": 2,
      "start": 29,
      "end": 60,
      "text": "释放出广东厚植原创发展沃土、支持广大音乐人创作好歌曲的强烈信号",
      "type": "viewpoint"
    },
    {
      "id": "ai-6-3-26-viewpoint",
      "paragraphIndex": 6,
      "start": 3,
      "end": 26,
      "text": "大赛坚持时代性、群众性、原创性、流行性四大原则",
      "type": "viewpoint"
    },
    {
      "id": "ai-9-35-87-viewpoint",
      "paragraphIndex": 9,
      "start": 35,
      "end": 87,
      "text": "从精品创作、产业集群、演出活动、空间建设、版权保护、金融服务、数字贸易及人才培养八大维度推出若干重点措施",
      "type": "viewpoint"
    },
    {
      "id": "ai-0-0-5-exam_point",
      "paragraphIndex": 0,
      "start": 0,
      "end": 5,
      "text": "8月25日",
      "type": "exam_point"
    },
    {
      "id": "ai-0-25-30-exam_point",
      "paragraphIndex": 0,
      "start": 25,
      "end": 30,
      "text": "500余位",
      "type": "exam_point"
    },
    {
      "id": "ai-4-4-13-exam_point",
      "paragraphIndex": 4,
      "start": 4,
      "end": 13,
      "text": "华语流行音乐原创榜",
      "type": "exam_point"
    },
    {
      "id": "ai-6-127-133-exam_point",
      "paragraphIndex": 6,
      "start": 127,
      "end": 133,
      "text": "AI音乐赛道",
      "type": "exam_point"
    },
    {
      "id": "ai-7-4-10-exam_point",
      "paragraphIndex": 7,
      "start": 4,
      "end": 10,
      "text": "10月25日",
      "type": "exam_point"
    },
    {
      "id": "ai-7-100-103-exam_point",
      "paragraphIndex": 7,
      "start": 100,
      "end": 103,
      "text": "46首",
      "type": "exam_point"
    },
    {
      "id": "ai-9-13-34-exam_point",
      "paragraphIndex": 9,
      "start": 13,
      "end": 34,
      "text": "《广州市推动音乐产业高质量发展的若干措施》",
      "type": "exam_point"
    },
    {
      "id": "ai-18-43-58-exam_point",
      "paragraphIndex": 18,
      "start": 43,
      "end": 58,
      "text": "网络音乐总产值约占全国四分之一",
      "type": "exam_point"
    },
    {
      "id": "ai-4-17-27-term",
      "paragraphIndex": 4,
      "start": 17,
      "end": 27,
      "text": "流行音乐产业协作联盟",
      "type": "term",
      "explanation": "由多方机构组成的产业合作组织，旨在搭建跨行业资源对接与协同发展的平台。"
    },
    {
      "id": "ai-6-127-133-term",
      "paragraphIndex": 6,
      "start": 127,
      "end": 133,
      "text": "AI音乐赛道",
      "type": "term",
      "explanation": "利用人工智能技术进行音乐创作的比赛类别，是本次大赛新增的特别赛道。"
    },
    {
      "id": "ai-12-37-41-term",
      "paragraphIndex": 12,
      "start": 37,
      "end": 41,
      "text": "票根经济",
      "type": "term",
      "explanation": "以演出门票为凭证带动相关消费的经济模式，如餐饮、住宿等联动消费。"
    }
  ],
  "aiQuality": {
    "locationErrors": 0
  }
}