{
  "id": "f348c345ac",
  "date": "2026-09-08",
  "title": "江苏省人民政府 要闻关注 信长星主持召开书记专题会议和省委常委会会议听取十四届省委第九轮巡视和第五次巡视整改专项督查综合情况，研究部署相关工作 坚持动真碰硬 深化标本兼治 扎扎实实做好巡视“后半篇文章”",
  "source": "中国政府网",
  "url": "http://www.jiangsu.gov.cn/art/2026/9/8/art_84322_11826517.html",
  "pubDate": "",
  "fetchedAt": "2026-09-08T23:52:00+00:00",
  "status": "ok",
  "paragraphs": [
    "9月4日、7日，省委书记信长星先后主持召开书记专题会议和省委常委会会议，听取十四届省委第九轮巡视和第五次巡视整改专项督查综合情况，研究部署相关工作。",
    "根据省委统一安排，今年3月至7月，十四届省委第九轮巡视对27家省属国企、12家省级机关部门开展常规巡视，对4个对口支援前方工作机构开展专项巡视，同步对十四届省委第五至七轮巡视的131家单位巡视整改落实情况进行专项督查。",
    "会议指出，本轮巡视全面贯彻中央巡视工作方针，突出“两个维护”根本任务，紧扣省属国企、省级机关部门、对口支援前方工作机构不同特点，靶向监督更加聚焦，问题研判更加精准，有效彰显了巡视监督的震慑力、穿透力、推动力。从巡视情况看，被巡视党组织认真贯彻落实习近平总书记对江苏工作重要讲话和对本行业本领域重要指示批示精神，各项工作取得良好成效，为全省经济社会发展作出了积极贡献。从专项督查情况看，被督查党组织认真落实巡视整改责任，扎实推进整改工作，改革发展和党的建设取得新进展。巡视和专项督查也发现一些突出问题，必须动真碰硬推动整改落实，举一反三深化标本兼治，扎扎实实做好巡视“后半篇文章”。",
    "会议强调，要坚持目标导向和问题导向相结合，通过扎实有效的整改，进一步做强做优做大国有资本和国有企业，加快建设让党放心、让人民群众满意的模范机关，持续提升对口支援协作合作质效。要强化责任落实，压紧压实党委（党组）整改责任，推动被巡视单位把整改融入日常工作、融入深化改革、融入全面从严治党、融入领导班子和干部队伍建设、融入巩固拓展树立和践行正确政绩观学习教育成果工作。要强化督促检查，健全巡视整改闭环管理机制，跟进掌握整改情况，加强日常监督，对整改不力的及时开展“回头看”、杀“回马枪”，对敷衍整改、虚假整改的严肃问责。要强化建章立制，督促相关单位既重拳出击“当下改”，又建章立制“长久立”，严格制度执行，做到用制度管人管事管权，推动巡视反馈问题查到根、改彻底。",
    "会议强调，十四届省委巡视全覆盖任务圆满完成。省委巡视机构要科学谋划未来五年巡视工作，进一步明确目标任务、重点方向、实施路径，坚定不移深化政治巡视，推动巡视工作向深拓展、向专发力、向下延伸，不断增强巡视监督实效，为推进中国式现代化江苏新实践提供坚强保障。"
  ],
  "keySentences": [],
  "aiModel": "deepseek-chat",
  "aiPromptVersion": "article-analysis-v1",
  "aiGeneratedAt": "2026-09-08T23:52:01+00:00",
  "sourceTextHash": "9c118d8dbd285aa4138896a57364bbe11bc404333e975944e25c638feadeaa7f",
  "aiStatus": "error",
  "aiAnnotations": [],
  "aiError": "ai_semantic:summary_length"
}