{
  "id": "03bb475a7f",
  "date": "2026-08-27",
  "title": "习近平主席出席上合组织峰会并访问吉尔吉斯斯坦、埃及前瞻",
  "source": "半月谈",
  "url": "http://www.banyuetan.org/jrt/detail/20260827/1000200033134991787793276298430818_1.html",
  "pubDate": "",
  "fetchedAt": "2026-08-27T02:56:41+00:00",
  "status": "ok",
  "paragraphs": [
    "8月30日至9月3日，国家主席习近平将出席在比什凯克举行的2026年上海合作组织峰会，并应吉尔吉斯斯坦总统扎帕罗夫、埃及总统塞西邀请对两国进行国事访问。",
    "百年变局之下，人类社会站在历史的十字路口。习近平主席此次出访，将同各方共商合作大计，擘画上合组织发展蓝图，共促地区繁荣稳定，为完善全球治理贡献“上合智慧”，为推动和平发展汇聚全球南方力量，携手各方沿着构建人类命运共同体的人间正道不断前行。",
    "黄海之滨，塔吊林立，巨轮穿梭。中国－上海合作组织地方经贸合作示范区内，一列列“钢铁驼队”整装待发，驶向中亚与欧洲。",
    "2025年8月27日，一列货运列车驶入位于上合示范区内的中国-上海合作组织地方经贸合作示范区多式联运中心（无人机照片）。新华社记者 李紫恒 摄",
    "陕西杨凌，绿浪翻滚，硕果盈枝。各国农业专家忙碌于上海合作组织农业技术交流培训示范基地的田间和温室，交流各种新技术。",
    "2025年5月19日，上海合作组织减贫和可持续发展论坛与会人员在陕西杨凌参观旱区农业节水技术与装备田间展。新华社记者 邵瑞 摄",
    "从时光深处走来，上海合作组织历经25年发展，已是枝繁叶茂，向更广阔处生长。",
    "成立25年来，在互信、互利、平等、协商、尊重多样文明、谋求共同发展的“上海精神”引领下，上合组织从6个创始成员国发展成为覆盖亚欧非三大洲27个国家的“上合大家庭”，展现出蓬勃生命力和强大磁吸力，树立起新型国际关系典范。",
    "“尽管乱云飞渡，我们践行‘上海精神’而取得成功。”2025年9月，习近平主席在天津主持上海合作组织成员国元首理事会第二十五次会议时，道出“上合之路”越走越宽广的真谛。",
    "2013年以来，习近平主席出席历次上合组织峰会。从提出弘扬“上海精神”促进共同发展，到推动构建更加紧密的上海合作组织命运共同体，从建设团结互信、和平安宁、繁荣发展、睦邻友好、公平正义“五个共同家园”，到以“五个坚持”为上合组织发展指明方向，习近平主席着眼人类共同利益，以深刻洞察、宏阔视野推动上合组织行稳致远，与时俱进丰富发展“上海精神”，以脚踏实地的中国行动为这一合作机制注入不竭动力。",
    "一年前，上合组织天津峰会对未来10年发展作出战略擘画，开启上合组织高质量发展新阶段。一年来，中方同各方共同落实习近平主席提出的重大倡议，以中国行动赋能地区发展。",
    "绿色产业、数字经济、科技创新、能源、高等教育、职业技术教育、人工智能7个应用平台全部启用，形成160多个项目；经贸合作高质量发展行动计划持续实施，中国同各成员国贸易稳步增长；100个“小而美”民生项目立项超过三分之二……",
    "“在推动构建上合组织命运共同体的过程中，中国既是架构师，又是驱动力。”乌兹别克斯坦塔什干国立东方大学教授赛义夫丁·茹拉耶夫感慨。",
    "一年前，上合组织天津峰会期间，习近平主席郑重提出全球治理倡议，得到国际社会迅速支持响应。当前，中国同上合伙伴致力于当好践行全球治理倡议的表率，会同近160个落实全球治理倡议参与方、120多个支持同上合组织深化合作的联合国会员国，探讨建立各方共同参与的全球治理有效模式，持续壮大全球治理正能量。",
    "吉尔吉斯斯坦世界政治研究所所长舍拉季尔·巴克特古洛夫表示，习近平主席的远见卓识深刻影响着上合组织的当前议程和长远战略，上合组织倡导的和平、平等、互利合作等价值理念得到日益广泛的全球认同。",
    "国际形势愈是风云激荡，上合组织的笃定前行愈显光芒。25年风雨兼程，上合组织始终顺应时代大势，回应民众期待，秉持公平正义，不断推进区域合作，巩固团结互信，成为动荡变革世界中当之无愧的稳定力量、合作力量、进步力量。",
    "山海不为远，同心向未来。从天津到比什凯克，中国将继续同上合组织成员国一道，秉持“上海精神”，汇集智慧力量，为全球治理贡献更多“上合方案”。",
    "“中国和吉尔吉斯斯坦山水相依、民心相亲，是好邻居、好朋友、好伙伴。”2025年2月5日，习近平主席同吉尔吉斯斯坦总统扎帕罗夫举行会谈时，用三个“好”形容中吉关系。",
    "从立春时节的北京，到夏日的哈萨克斯坦阿斯塔纳，再到夏末秋初的海河之畔天津，2025年一年间，习近平主席和扎帕罗夫总统三度会晤，为中吉关系发展擘画蓝图，为两国携手奔赴现代化注入动力，为延续千年的友谊续写时代新篇。",
    "古丝绸之路穿过碎叶古城，黠戛斯人的脚步远至唐都长安。千年历史积淀铸就了中吉人民的深情厚谊。",
    "“吉尔吉斯斯坦最宝贵的优势就是与中国为邻。”在扎帕罗夫总统看来，中国古语“亲仁善邻，国之宝也”正是对吉中关系的生动描述，吉方坚持将对华关系作为对外政策的优先方向。",
    "建交30多年来，两国风雨同舟、守望相助，经受住国际风云变幻考验。近年来，在习近平主席和扎帕罗夫总统战略引领下，中吉本着同舟共济、互利共赢精神结为新时代全面战略伙伴，正携手构建睦邻友好、共享繁荣的中吉命运共同体，双方务实合作驶入“快车道”。",
    "2026年2月13日，在吉尔吉斯斯坦贾拉拉巴德州，中国建设工人在中吉乌铁路贾拉拉巴德隧道施工作业。新华社发（任卫云 摄）",
    "在吉尔吉斯斯坦南部贾拉拉巴德州境内的崇山峻岭间，中国－吉尔吉斯斯坦－乌兹别克斯坦铁路（中吉乌铁路）项目的施工现场忙碌有序。",
    "2024年12月，习近平主席在致中吉乌铁路项目启动仪式的贺信中指出，建设中吉乌铁路是三国政府着眼区域互联互通、促进地区繁荣稳定作出的战略决策，彰显了三国人民对打通这条战略通道的美好愿望。",
    "位于中亚腹地的吉尔吉斯斯坦，是最早支持并积极参与共建“一带一路”的国家之一。如今，中吉合作建设的干线公路——新北南公路一、二期工程已建成通车，成为造福百姓的“幸福路”。中吉乌公路持续拓展延伸，如今迈入公铁联运新阶段，成为区域互联互通的重要通道。",
    "多年来，中国一直是吉尔吉斯斯坦最重要的贸易和投资伙伴之一。2025年，中吉贸易额达272亿美元，同比增长19.8%。",
    "2025年6月1日，在新疆伊尔克什坦口岸，边检站执勤民警在检查出口商品车。新华社发（费强 摄）",
    "来自吉尔吉斯斯坦的蜂蜜、水果等绿色优质农产品摆上中国百姓餐桌，来自中国的新能源汽车行驶在吉尔吉斯斯坦的大街小巷。在中吉边境伊尔克什坦口岸，24小时通关的便利政策让往返两国的边贸从业者跑出“加速度”，大量机械设备、日用家电等“中国制造”经此源源不断运往中亚和欧洲。",
    "中吉人文交流日益走深走实。在比什凯克，鲁班工坊培养数千名本土技术人才，智慧水利、电气装备等课程标准正式融入国民教育体系，助力当地教育现代化升级。孔子学院书声琅琅，成为越来越多吉尔吉斯斯坦年轻人了解中国、追逐梦想的窗口。中吉两国共同培育友谊的新芽，为构建睦邻友好、共享繁荣的中吉命运共同体厚植民心根基。",
    "在国际和地区事务中，中吉始终相互信任，加强在联合国、中国-中亚机制等多边框架内的沟通协调，践行多边主义，携手促进地区和世界和平发展。",
    "“在元首外交引领下，吉中关系进入内涵日益丰富、成果极其丰硕的时期。”吉尔吉斯斯坦前外长阿利克别克·叶克申库洛夫期待着，习近平主席再次到访吉尔吉斯斯坦，将成为吉中关系发展的又一个重要里程碑，成为推动双边关系迈向更高质量、更深层次的“关键一步”。",
    "8月的阳光洒落在开罗老城，金字塔的轮廓勾勒出千年文明的剪影。横跨亚非大陆的古老国度，正以崭新的姿态欢迎来自东方的贵宾。",
    "“中埃关系已经成为发展中国家友好相处、团结协作的典范和中阿、中非集体合作的样板，正朝着构建面向新时代命运共同体的目标阔步前行。”今年5月30日，在中埃建交70周年的重要节点，习近平主席同埃及总统塞西互致贺电，高度评价中埃关系。",
    "70年来，无论国际和地区形势如何变化，两国始终相互尊重、平等相待、彼此信任、守望相助。回望来路，中埃关系何以历久弥新、不断开拓前行？",
    "元首引领是中埃关系行稳致远的根本保障。十多年来，习近平主席同塞西总统会晤十余次，共同引领中埃关系蓬勃发展。2014年，两国元首共同决定将中埃关系提升为全面战略伙伴关系。2016年，习近平主席对埃及进行国事访问，为新时代中埃关系发展注入强劲动力。2024年，埃及成为首个将构建命运共同体目标写入双边关系联合声明的阿拉伯国家，充分彰显两国关系的战略性和高水平。",
    "互利合作是两国关系的活力源泉。从基础设施建设、新能源开发到数字经济、人工智能等新兴领域合作，从双边贸易额持续攀升到产业链供应链深度融合，互利共赢的合作为两国民众创造实实在在的福祉。",
    "这是2025年5月28日在埃及苏伊士省拍摄的中埃·泰达苏伊士经贸合作区一景。新华社记者 姚兵 摄",
    "走进位于红海之滨的中埃苏伊士经贸合作区，接待大厅内一个典雅的青花瓷盘引人注目。“瓷盘底座上，代表黄河与尼罗河的曲线彼此交汇，预示着合作区在中埃两大文明共同滋养下蓬勃发展。”埃及泰达特区开发公司管理总监韦娜说。2016年1月，习近平主席和塞西总统共同为中埃苏伊士经贸合作区二期揭牌。",
    "截至2026年6月底，合作区吸引200余家企业入驻，累计吸引投资额超47亿美元，直接创造就业岗位超1万个，间接带动就业数万人，成为中埃产能合作的重要平台和埃及工业化的重要载体。埃及泰达特区开发公司首席执行官娜赫拉·伊马德说，合作区的发展“正是埃中关系持续深化、两国政府高度互信与合作的生动体现”。",
    "如今，中企参建的埃及新行政首都中央商务区、斋月十日城轻轨等项目已成为埃及现代化建设的重要标志。随着共建“一带一路”倡议与埃及“2030愿景”深度对接，两大文明古国在发展振兴道路上更加紧密地并肩同行。",
    "文明互鉴是人民友好的深厚纽带。近年来，中文纳入埃及国民教育体系，“中文热”“中国文化热”在埃及持续升温，越来越多埃及年轻人赴华留学深造，成为中埃友好的使者；大埃及博物馆吸引众多中国游客参观，上海博物馆“古埃及文明大展”成功举办；中埃联合考古队在萨卡拉、卢克索等地续写文明对话新篇……多层面人文交流架设中埃、中阿人民相知相亲的桥梁。",
    "面对百年变局加速演进，中埃始终站在历史正确一边，坚定维护发展中国家正当权益，在联合国、金砖国家、上合机制、中阿合作论坛、中非合作论坛等多边框架内加强协调配合，推动全球治理体系朝着更加公正合理的方向发展。",
    "埃及总理助理、内阁信息与决策支持中心主任乌萨马·古哈里说，埃中建交70年来彼此信任和理解，两国关系彰显十足的韧性和巨大发展潜力，相信两国元首将引领埃中关系迈向更广阔的未来，造福两国，增益世界。"
  ],
  "keySentences": [],
  "aiModel": "deepseek-chat",
  "aiPromptVersion": "article-analysis-v1",
  "aiGeneratedAt": "2026-08-27T02:56:43+00:00",
  "sourceTextHash": "a56c678d957c8b28d37e686c77996718c5e9aa055d1b4681d41af93cb985602f",
  "aiStatus": "error",
  "aiAnnotations": [],
  "aiError": "ai_provider:request_failed"
}