{
  "id": "1d4b805c7b",
  "date": "2026-09-16",
  "title": "你的梦想有多具体？｜百万英才汇南粤",
  "source": "news.dayoo.com",
  "url": "https://news.dayoo.com/guangdong/202609/16/139996_55004044.htm",
  "pubDate": "",
  "fetchedAt": "2026-09-16T06:20:46+00:00",
  "status": "ok",
  "paragraphs": [
    "你的梦想有多具体？也许是你手上的简历，是你身旁的有轨电车，又或许是你灵光一现的想法。9月16日至20日，“百万英才汇南粤”2026年N城联动秋季招聘活动走进上海、南京、杭州三地，用5天时间举办17场校园招聘会。在此，我们借这“一镜到底”的城市邀约，接住你的梦想。&nbsp;",
    "剪辑/广州日报新花城编辑：甄志良&nbsp;&nbsp;"
  ],
  "keySentences": [],
  "aiModel": "deepseek-chat",
  "aiPromptVersion": "article-analysis-v1",
  "aiGeneratedAt": "2026-09-16T06:20:48+00:00",
  "sourceTextHash": "b2f04d5b67fe7dbf398483d9bcfe6ba7b031f43acaad0d3f8df924b42cc383f0",
  "aiStatus": "ok",
  "aiSummary": "9月16日至20日，“百万英才汇南粤”2026年N城联动秋季招聘活动走进上海、南京、杭州，5天举办17场校园招聘会，以城市邀约接住你的梦想。",
  "aiAnnotations": [
    {
      "id": "ai-0-0-9-viewpoint",
      "paragraphIndex": 0,
      "start": 0,
      "end": 9,
      "text": "你的梦想有多具体？",
      "type": "viewpoint"
    },
    {
      "id": "ai-0-42-51-exam_point",
      "paragraphIndex": 0,
      "start": 42,
      "end": 51,
      "text": "9月16日至20日",
      "type": "exam_point"
    },
    {
      "id": "ai-0-52-76-term",
      "paragraphIndex": 0,
      "start": 52,
      "end": 76,
      "text": "“百万英才汇南粤”2026年N城联动秋季招聘活动",
      "type": "term",
      "explanation": "广东省面向高校毕业生组织的大规模跨城联动秋季招聘活动，旨在吸引人才赴粤就业创业。"
    },
    {
      "id": "ai-0-78-88-exam_point",
      "paragraphIndex": 0,
      "start": 78,
      "end": 88,
      "text": "上海、南京、杭州三地",
      "type": "exam_point"
    },
    {
      "id": "ai-0-90-104-exam_point",
      "paragraphIndex": 0,
      "start": 90,
      "end": 104,
      "text": "5天时间举办17场校园招聘会",
      "type": "exam_point"
    },
    {
      "id": "ai-0-124-130-viewpoint",
      "paragraphIndex": 0,
      "start": 124,
      "end": 130,
      "text": "接住你的梦想",
      "type": "viewpoint"
    }
  ],
  "aiQuality": {
    "locationErrors": 0
  }
}