{
  "id": "f30fda62b6",
  "date": "2026-08-28",
  "title": "珠联璧合 相向而行！粤港澳大湾区产学研创新协同深入推进",
  "source": "news.dayoo.com",
  "url": "https://news.dayoo.com/guangdong/202608/28/139996_54997035.htm",
  "pubDate": "",
  "fetchedAt": "2026-08-28T05:58:08+00:00",
  "status": "ok",
  "paragraphs": [
    "新华社广州8月27日电 香港科技大学霍英东研究院的展厅里，有一处智能光学显微成像展台，它的拥有者凯佳光科是一家创立于广州南沙的科技企业。从“1个人、1个书包”到成规模的研发团队，从千万级天使轮投资到国家高新技术企业认定……凯佳光科用5年时间，取得令人艳羡的创业成果。",
    "这一切，离不开香港科技大学霍英东研究院“保姆级”的孵化支持。选址广州南沙，研究院依托香港科技大学的科研及教育优势，致力于粤港深度合作下的应用科技研发与成果转化，成为粤港澳大湾区产学研创新协同的鲜活缩影。",
    "24日至26日，由中央港澳办和中国记协共同举办的“对接‘十五五’发挥新优势”主题联合采访第二阶段活动走进广州、东莞。来自中央和粤港澳三地媒体的近50名记者及自媒体人实地走访企业、科研院校和政府机构，真切感受产学研创新协同助推大湾区高质量发展的澎湃动力。",
    "国家“十五五”规划纲要在港澳专章里提出，深化与内地产学研创新协同。依托粤港澳大湾区的优势，香港、澳门与大湾区内地城市珠联璧合、相向而行，创新技术研发和科技成果产业化迎来不可限量的光明前景。",
    "“港科大是最先‘北上’的香港高校。”香港科技大学霍英东研究院院长高民介绍，研究院自成立以来，孵化服务涵盖新一代信息技术、智能制造、微电子、生物医药大健康、新材料和新能源技术等多个领域。",
    "过去5年，由研究院孵化的企业，有16家获得投资，总融资额超过4亿元，总估值超过20亿元。",
    "“研究院也积极探索将国家重大科技资源辐射至港澳及海外。”高民说，作为国家超级计算广州中心南沙分中心的运营单位，研究院已为港澳及海外270多个科研用户团队提供超过3.5亿核时的超级算力，帮助用户加快产出优秀科研成果的步伐。",
    "在高民看来，发展创新科技产业，推动产学研协同，除了市场化运作，政府的政策支持、资金投入、优化营商环境，都很重要。",
    "香港科技大学霍英东研究院所在的广州南沙，正以实际行动书写答卷。“我们已先后落地实施‘放宽市场准入15条’‘南沙金融30条’等重磅政策，并落户了10亿元环港科大（广州）科技成果转化母基金和20亿元的木棉花湾区高校科创投资基金。”广州市政府副秘书长、南沙开发区管委会副主任谢伟说。",
    "他还介绍，“十五五”期间，南沙将打造催生新质生产力的科创高地。加速南沙科学城建设，推进环港科大（广州）创新区、全国重点实验室大湾区技术转移转化中心等平台建设，推动更多科技成果在南沙落地转化。",
    "潮起伶仃，风正帆悬。在踊跃“出海”的粤企里，广药集团始终将港澳作为推进产学研用协同的重要阵地。广药集团副董事长、总经理陈杰辉介绍，广药集团和香港大学、澳门大学、澳门科技大学建立了长期科研合作关系。“比如，在澳门，广药集团与澳门大学中药质量研究国家重点实验室协同共建中药产业转化联合实验室。集团还依托在澳门青洲的制药厂，打造了集生产制造、科研中试、人才实训于一体的复合型基地。”",
    "他表示，面向“十五五”，广药集团会持续扩大港澳高校联合实验室布局，支持港澳高校科研成果优先在广药体系实现产业化，同时将充分用好港澳两地平台，吸纳香港、澳门高校生物医药、中医药的科研和产业人才，推进人才联合培养。",
    "在东莞松山湖科学城，产学研创新协同的氛围愈显浓厚。XbotPark机器人基地里，主攻扫拖一体机器人的“云鲸智能”、深耕电动船外机的“逸动科技”、发明无弦吉他的“未知星球”……一个个由创新技术立身、以产业化突围的故事，激励着更多“硬科技”研发团队走上孵化之路。",
    "XbotPark机器人基地供应链技术总监俞春华说，共享工厂是基地的一大特色，将集成开发与精益生产相结合，提供从概念到量产的一站式制造解决方案，有效解决初创企业供应链获取难、议价能力弱等问题。“有研发团队来松山湖，1天之内就决定留下来，正是看中了共享工厂的助益。”",
    "截至目前，这个基地的共享工厂已服务140多个企业和团队，助力初创企业产品落地出货超过30万件。",
    "与机器人基地相距不到3公里，坐落着今年刚刚培养出第一批硕士毕业生的香港城市大学（东莞）。优美的校园环境、先进的科研设施、完备的师资团队，让这所新近“北上”的港校受到内地优质生源青睐。",
    "香港城市大学（东莞）副校长赵志裕说，学校在专业设置上紧密对接大湾区与东莞“8＋8＋4”现代化产业体系建设的需求。",
    "“我们学校周边集聚了散裂中子源、先进阿秒激光设施等国家大科学装置，以及东莞材料所、华为等科研平台与龙头企业。”赵志裕说，“校园在实验室群中”的独特生态，有助于科技创新与产业创新的深度融合。“十五五”期间，学校将加速搭建科技成果跨境转化的“高架桥”，让更多“香港研发”在“湾区制造”中开花结果。"
  ],
  "keySentences": [],
  "aiModel": "deepseek-chat",
  "aiPromptVersion": "article-analysis-v1",
  "aiGeneratedAt": "2026-08-28T05:58:09+00:00",
  "sourceTextHash": "5e9c13e52f861bc19a348f645f98e016548048736d15b99781a5d6ab4306c814",
  "aiStatus": "error",
  "aiAnnotations": [],
  "aiError": "ai_provider:request_failed"
}